Kids_First_Participant_ID	Kids_First_Biospecimen_ID_normal	Kids_First_Biospecimen_ID_tumor	plot_group	molecular_subtype	mean_gsea_score	Hugo_Symbol_germline	Hugo_Symbol_somatic
PT_5BWZA0NT	BS_85TADN40	BS_BFDEZK1C	DIPG or DMG	DMG, H3 K28	0.4529171113406566	NA	ALK; ATRX; DKC1; EXT1; FANCC; IKZF1; MET; NF1; PDGFRA; PTPN11; RPS19; RPS7; SHOC2; TERT
PT_6GDPNFA6	BS_N56BGDK6	BS_XGVSX8BX	Other high-grade glioma	HGG, H3 wildtype	0.448911635533273	NA	ATRX; BARD1; FANCF; HABP2; KRAS; MET; MITF; RPS19
PT_6SH7PV1N	BS_XQ0Y2PMV	BS_MW63FCZC	Other high-grade glioma	HGG, H3 wildtype	0.4100827134314648	NA	ETV6; FANCC; RAF1; RUNX1
PT_9BZETM0M	BS_GBQ6A3ST	BS_STNH7YSX	DIPG or DMG	DHG, H3 G35	0.49309187070941146	XPC	ALK; BMPR1A; DIS3L2; MET; MITF; MSH2; PAX5; RPS7; RUNX1; SOS1; SUFU; TP53; ZEB2
PT_JJZ5PN64	BS_ZWSDP4RT	BS_5YTKXXBY	Other high-grade glioma	HGG, H3 wildtype, TP53	0.4347528044332639	NA	FGFR1; MTAP; TP53
PT_N3205P0D	BS_JJ593ZW7	BS_EPM623G4	DIPG or DMG	DHG, H3 G35, TP53	0.4266636909553394	NA	ABCB11; ALK; ASXL1; ATRX; BRCA1; BUB1B; CDC73; CDH1; DICER1; DIS3L2; EGFR; EPCAM; FGFR2; GDNF; GPC3; HACE1; MITF; MSH2; MTAP; NF2; NRAS; PTEN; RAD51C; RPS10; RPS17; RUNX1; SMARCA2; STAT3; STK11; TP53; TSC1; TSC2
PT_TWAHK62W	BS_R63R4S9H	BS_W60PB1DS	Other high-grade glioma	HGG, H3 wildtype, TP53	0.5443342116431961	NA	CREBBP; EGFR; TP53
PT_Y5KY6KN9	BS_NWXG4ZNS	BS_AYPBAHJ6	DIPG or DMG	DMG, H3 K28, TP53	0.4058714340358132	NA	ATRX; BRCA1; CREBBP; DDB2; DOCK8; EGFR; EXT1; FGFR2; FMR1; GPC4; IKZF1; MET; MSH2; NF1; PTEN; SLC25A13; TP53; ZEB2
PT_Z4BF2NSB	BS_ZY319KJ4	BS_W2QCHQ7E	Other high-grade glioma	HGG, H3 wildtype, TP53	0.5778510111995002	NA	ALK; APC; BMPR1A; BRCA2; CBL; DKC1; DOCK8; EXT1; FANCD2; FGFR1; GPC3; ITK; RAF1; RB1; SH2B3; SMARCB1; TP53; TSC2
